booktitle,booklink
Do it! 점프 투 파이썬,/Product/Goods/74419916?OzSrank=1
혼자 공부하는 머신러닝+딥러닝,/Product/Goods/96024871?OzSrank=2
혼자 공부하는 파이썬,/Product/Goods/74269975?OzSrank=3
두근두근 파이썬,/Product/Goods/35279965?OzSrank=4
이것이 취업을 위한 코딩 테스트다 with 파이썬 ,/Product/Goods/91433923?OzSrank=5
파이썬 for Beginner,/Product/Goods/83849188?OzSrank=6
핸즈온 머신러닝,/Product/Goods/89959711?OzSrank=7
밑바닥부터 시작하는 딥러닝 ,/Product/Goods/34970929?OzSrank=8
파이썬 알고리즘 인터뷰,/Product/Goods/91084402?OzSrank=9
파이썬 머신러닝 완벽 가이드,/Product/Goods/87044746?OzSrank=10
Do it! 첫 파이썬,/Product/Goods/89904189?OzSrank=11
Do it! 점프 투 파이썬 + Do it! 첫 파이썬 ,/Product/Goods/91446188?OzSrank=12
따라하며 배우는 파이썬과 데이터 과학,/Product/Goods/96555988?OzSrank=13
Do it! 자료구조와 함께 배우는 알고리즘 입문 : 파이썬 편,/Product/Goods/91219874?OzSrank=14
모두의 데이터 분석 with 파이썬,/Product/Goods/72227684?OzSrank=15
미국 주식으로 시작하는 슬기로운 퀀트투자,/Product/Goods/103915601?OzSrank=16
파이썬 증권 데이터 분석 ,/Product/Goods/90578506?OzSrank=17
파이썬으로 쉽게 풀어쓴 자료구조,/Product/Goods/89141599?OzSrank=18
Do it! 파이썬 생활 프로그래밍,/Product/Goods/91437485?OzSrank=19
Do it! 점프 투 파이썬 + Do it! 자료구조와 함께 배우는 알고리즘 입문 : 파이썬 편 + Do it! 파이썬 생활 프로그래밍,/Product/Goods/91446242?OzSrank=20
